{
  "$schema": "./schema.json",
  "name": "radio",
  "component": "LhRadio",
  "since": "0.1.0",
  "description": "单选框：圆环选中控件，选中态内含圆点；选中后再次点击不会取消选中。",
  "props": [
    {
      "name": "checked",
      "type": "boolean",
      "default": false,
      "description": "是否选中"
    },
    {
      "name": "disabled",
      "type": "boolean",
      "default": false,
      "description": "是否禁用；禁用时不响应点击且呈现禁用样式"
    },
    {
      "name": "label",
      "type": "string",
      "default": "",
      "description": "文字标签（绘制在圆环右侧）"
    },
    {
      "name": "value",
      "type": "string",
      "default": "",
      "description": "单选值（组内标识，组件本身不含组逻辑，由宿主维护单选组）"
    },
    {
      "name": "size",
      "type": "enum",
      "values": ["small", "medium", "large"],
      "default": "medium",
      "description": "圆环尺寸，映射到 radio.size.* 令牌"
    }
  ],
  "events": [
    {
      "name": "onChange",
      "payload": [
        { "name": "checked", "type": "boolean", "description": "点击后的新选中态（仅可能为 true）" }
      ],
      "description": "由未选中变为选中时触发；已选中时点击不触发，disabled 为 true 时不触发"
    }
  ],
  "slots": [
    { "name": "default", "description": "文字标签内容" }
  ],
  "behaviors": [
    "size 映射：small/medium/large 分别取 radio.size.<size> 圆环尺寸令牌",
    "外环描边：未选中取 color.border.base，选中取 color.primary.default，描边宽 radio.ringWidth",
    "选中时内部画实心圆点，直径 = 尺寸 × radio.dotScale，取 color.primary.default",
    "disabled：外环取 color.disabled.border，圆点取 color.disabled.text，文字取 color.text.disabled，且不响应点击",
    "点击命中整个行（圆环 + 标签区域）：仅当未选中且未禁用时变为选中并触发 onChange(checked=true)",
    "圆环与文字间距取 radio.gap"
  ],
  "tokenRefs": [
    "radio.size.small",
    "radio.size.medium",
    "radio.size.large",
    "radio.ringWidth",
    "radio.dotScale",
    "radio.gap",
    "color.primary.default",
    "color.border.base",
    "color.disabled.border",
    "color.disabled.text",
    "color.text.primary",
    "color.text.disabled"
  ]
}
